{
  "$schema": "http://json-schema.org/draft-07/schema#",
  "title": "Finpath course manifest",
  "type": "object",
  "additionalProperties": false,
  "required": ["id", "title", "topic", "description", "units"],
  "properties": {
    "id": {
      "type": "string",
      "pattern": "^[a-z][a-z0-9-]*$"
    },
    "title": {
      "type": "string",
      "minLength": 1
    },
    "topic": {
      "type": "string",
      "minLength": 1
    },
    "description": {
      "type": "string",
      "minLength": 1
    },
    "units": {
      "type": "array",
      "minItems": 1,
      "items": {
        "type": "object",
        "additionalProperties": false,
        "required": ["id", "title", "description", "lessons"],
        "properties": {
          "id": {
            "type": "string",
            "pattern": "^[a-z][a-z0-9-]*$"
          },
          "title": {
            "type": "string",
            "minLength": 1
          },
          "description": {
            "type": "string",
            "minLength": 1
          },
          "lessons": {
            "type": "array",
            "minItems": 1,
            "uniqueItems": true,
            "items": {
              "type": "object",
              "additionalProperties": false,
              "required": [
                "id",
                "title",
                "description",
                "minutes",
                "icon",
                "file",
                "questions"
              ],
              "properties": {
                "id": {
                  "type": "string",
                  "pattern": "^[a-z][a-z0-9-]*$"
                },
                "title": {
                  "type": "string",
                  "minLength": 1
                },
                "description": {
                  "type": "string",
                  "minLength": 1
                },
                "minutes": {
                  "type": "integer",
                  "minimum": 1
                },
                "icon": {
                  "enum": ["chart", "radar", "layers", "bolt", "book"]
                },
                "file": {
                  "type": "string",
                  "pattern": "^[a-z0-9-]+\\.json$"
                },
                "questions": {
                  "type": "array",
                  "minItems": 1,
                  "items": {
                    "type": "object",
                    "additionalProperties": false,
                    "required": ["id", "topic"],
                    "properties": {
                      "id": {
                        "type": "string",
                        "pattern": "^[a-z][a-z0-9-]*$"
                      },
                      "topic": {
                        "type": "string",
                        "minLength": 1
                      }
                    }
                  }
                }
              }
            }
          },
          "kind": {
            "type": "string",
            "enum": ["lecture", "exam-prep"]
          },
          "notice": {
            "type": "string",
            "minLength": 1
          }
        }
      }
    }
  }
}
