{
  "id": "corporate-finance",
  "title": "Corporate Finance",
  "topic": "Exam prep & lecture practice",
  "description": "Three exam-prep sets, then four lecture topics. Five questions at a time.",
  "units": [
    {
      "id": "exam-prep",
      "kind": "exam-prep",
      "title": "Exam prep",
      "description": "Three short sets based on Homework 3 and Mock Quizzes 2A and 2B. Multiple choice and fill-in-number practice using the same tested formulas.",
      "notice": "The lecture practice below covers a broader range of material. Not every lecture question or topic will be on the exam. Use the homework, Quiz 2A/2B, and your instructor’s exam guidance to focus your preparation.",
      "lessons": [
        {
          "id": "exam-prep-1",
          "title": "Set 1 · Returns & risk",
          "description": "Compound growth, volatility, diversification, and CAPM.",
          "minutes": 4,
          "icon": "chart",
          "file": "exam-prep-1.json",
          "questions": [
            {
              "id": "prep1-geometric",
              "topic": "Geometric average return"
            },
            {
              "id": "prep1-volatility",
              "topic": "Measuring volatility"
            },
            {
              "id": "prep1-diversification",
              "topic": "Diversifiable risk"
            },
            {
              "id": "prep1-market-premium",
              "topic": "Market risk premium"
            },
            {
              "id": "prep1-capm",
              "topic": "CAPM expected return"
            }
          ]
        },
        {
          "id": "exam-prep-2",
          "title": "Set 2 · Markets & leverage",
          "description": "Information in prices, beta, and the MM propositions.",
          "minutes": 4,
          "icon": "layers",
          "file": "exam-prep-2.json",
          "questions": [
            {
              "id": "prep2-efficiency",
              "topic": "Semi-strong efficiency"
            },
            {
              "id": "prep2-news",
              "topic": "Earnings surprises"
            },
            {
              "id": "prep2-beta",
              "topic": "Interpreting beta"
            },
            {
              "id": "prep2-mm-value",
              "topic": "MM Proposition I"
            },
            {
              "id": "prep2-mm-equity",
              "topic": "MM Proposition II"
            }
          ]
        },
        {
          "id": "exam-prep-3",
          "title": "Set 3 · Hurdles & tax shields",
          "description": "Priced risk, project rates, WACC, and interest deductions.",
          "minutes": 5,
          "icon": "bolt",
          "file": "exam-prep-3.json",
          "questions": [
            {
              "id": "prep3-priced-risk",
              "topic": "Which risk is priced?"
            },
            {
              "id": "prep3-project-rate",
              "topic": "Project discount rates"
            },
            {
              "id": "prep3-interest-deduction",
              "topic": "Interest and corporate taxes"
            },
            {
              "id": "prep3-wacc",
              "topic": "After-tax WACC"
            },
            {
              "id": "prep3-tax-shield",
              "topic": "Present value of the tax shield"
            }
          ]
        }
      ]
    },
    {
      "id": "lecture-15",
      "title": "Lecture 15 · Capital markets",
      "description": "Markets, trading, and measuring returns.",
      "lessons": [
        {
          "id": "lec15-capital-markets",
          "title": "Capital markets",
          "description": "Markets, trading, and measuring returns.",
          "minutes": 4,
          "icon": "chart",
          "file": "lec15-capital-markets.json",
          "questions": [
            {
              "id": "lec15-compound-round-trip",
              "topic": "Compounded growth"
            },
            {
              "id": "lec15-limit-order",
              "topic": "Trading orders"
            },
            {
              "id": "lec15-market-claims",
              "topic": "What markets trade"
            },
            {
              "id": "lec15-dealer",
              "topic": "Brokers and dealers"
            },
            {
              "id": "lec15-volatility",
              "topic": "Measuring risk"
            }
          ]
        }
      ],
      "kind": "lecture"
    },
    {
      "id": "lecture-16",
      "title": "Lecture 16 · Market efficiency",
      "description": "Information, arbitrage, and prediction markets.",
      "lessons": [
        {
          "id": "lec16-market-efficiency",
          "title": "Market efficiency",
          "description": "Information, arbitrage, and prediction markets.",
          "minutes": 5,
          "icon": "radar",
          "file": "lec16-market-efficiency.json",
          "questions": [
            {
              "id": "lec16-efficiency-forms",
              "topic": "Information in prices"
            },
            {
              "id": "lec16-arbitrage",
              "topic": "Matching prices to payoffs"
            },
            {
              "id": "lec16-arbitrage-limits",
              "topic": "Limits to arbitrage"
            },
            {
              "id": "lec16-no-price",
              "topic": "Prediction market prices"
            },
            {
              "id": "lec16-replication",
              "topic": "Replicating a payoff"
            }
          ]
        }
      ],
      "kind": "lecture"
    },
    {
      "id": "lecture-17",
      "title": "Lecture 17 · Risk & return",
      "description": "Separate shared shocks from risks that can cancel.",
      "lessons": [
        {
          "id": "lec17-risk-return",
          "title": "Risk & diversification",
          "description": "Separate shared shocks from risks that can cancel.",
          "minutes": 4,
          "icon": "layers",
          "file": "lec17-risk-return.json",
          "questions": [
            {
              "id": "lec17-risk-types",
              "topic": "Two types of risk"
            },
            {
              "id": "lec17-insurance-pool",
              "topic": "When pooling helps"
            },
            {
              "id": "lec17-volatility-premium",
              "topic": "Which risk earns a premium?"
            },
            {
              "id": "lec17-airline-basket",
              "topic": "Look beneath the labels"
            },
            {
              "id": "lec17-corporate-diversification",
              "topic": "Who should diversify?"
            }
          ]
        }
      ],
      "kind": "lecture"
    },
    {
      "id": "lecture-18",
      "title": "Lecture 18 · CAPM & cost of equity",
      "description": "Beta, alpha, and the right hurdle for a project.",
      "lessons": [
        {
          "id": "lec18-capm",
          "title": "CAPM & cost of equity",
          "description": "Beta, alpha, and the right hurdle for a project.",
          "minutes": 5,
          "icon": "bolt",
          "file": "lec18-capm.json",
          "questions": [
            {
              "id": "lec18-cost-equity",
              "topic": "CAPM benchmark"
            },
            {
              "id": "lec18-alpha",
              "topic": "Return beyond beta"
            },
            {
              "id": "lec18-beta",
              "topic": "Interpreting beta"
            },
            {
              "id": "lec18-beta-drivers",
              "topic": "What drives equity beta?"
            },
            {
              "id": "lec18-project-hurdle",
              "topic": "The project’s opportunity cost"
            }
          ]
        }
      ],
      "kind": "lecture"
    }
  ]
}
